19th December 2024 , Fixed check.php for TiviMate module                             , Fix~, Fixed an issue which would rely on Official TiviMate but broke over time.                                                       , TiviMate           , https://i.imgur.com/uRg0UxZ.png
22nd December 2024 , Fixed an API issue                                              , Fix~, Fixed an API issue in StreamBox which could prevent the app from working as expected.                                           , StreamBox          , https://i.imgur.com/qHBgnHI.png
10th January 2025  , Fixed playlist names in IBO Sol.                                , Fix~, Fixed an oversight with the Playlist name setting in IBO Sol. panel making it always show Username regardless of setting.       , IBO Solutions      , https://i.imgur.com/z13H3dJ.png
10th January 2025  , Fixed an issue with VPN file names                              , Fix~, Fixed issue with naming of VPNs in some Smarters Pro mods preventing them from working correctly.                               , Smarters Pro       , https://i.imgur.com/iEb97E1.png
19th January 2025  , Added support for AH iMPlayer 3.7.5                             , Add~, Added support for the AndyHax iMPlayer 3.7.5 mod.                                                                               , iMPlayer TV        , https://i.imgur.com/88ScGTg.png
20th January 2025  , Added support for AH TiviMate 5.1.0-3                           , Add~, Added support for the AndyHax TiviMate 5.1.0-3 mod.                                                                             , TiviMate           , https://i.imgur.com/uRg0UxZ.png
21st January 2025  , Fixed responsiveness of Stremio API                             , Fix~, Fixed an issue with the Stremio response API which would not fire as quick as expected.                                         , Stremio            , https://i.imgur.com/546Gr2o.png
22nd January 2025  , Added support for AH SparkleTV 2.1.0                            , Add~, Added support for the AndyHax SparkleTV 2.1.0 mod.                                                                              , Sparkle TV         , https://i.imgur.com/qKEbeXG.png
22nd January 2025  , Added support for AH SmartTube 25.24                            , Add~, Added support for the AndyHax SmartTube 25.24 mod.                                                                              , SmartTube          , https://i.imgur.com/dOjhvLv.png
22nd January 2025  , Added support for AH 9Xtream 39.0.1                             , Add~, Added support for the AndyHax 9Xtream 39.0.1 mod.                                                                               , 9Xtream            , https://i.imgur.com/1BuEnVi.png
24th January 2025  , Updated FlixVision conf.json support                            , Add~, Updated FlixVision conf.json support for the latest mods when they arrive.                                                      , Flix Vision        , https://i.imgur.com/CQxNJjK.png
28th January 2025  , Fixed Maintenance mode                                          , Fix~, Fixed the time suffix for maintnance mode in XCIPTV.                                                                            , XCIPTV             , https://i.imgur.com/piaorjB.png
31st January 2025  , Added support for RTX 1.1.6 Mod                                 , Add~, Added support for the RTX Mods version of the app.                                                                              , HDO Box            , https://i.imgur.com/GOgN9xF.png
1st February 2025  , Added FCD Box Module                                            , Add~, Added support for the FCD Box Mods                                                                                              , FCD Box            , https://i.imgur.com/Q0Et9PS.png
3rd February 2025  , Updated support for ionCube Loaders 14.0.2                      , Add~, Updated support for ionCube Loaders 14.0.2 in panel and all modules                                                             , Cockpit            , https://i.imgur.com/xR0JjJh.png
4th February 2025  , Fixed an issue with some endpoints                              , Fix~, Fixed an issue with some endpoints not working as expected                                                                      , Multi-service Proxy, https://i.imgur.com/mgtUBgN.png
4th February 2025  , Added support for more endpoints                                , Add~, Added support for more endpoints in the Multi-service Proxy module                                                              , Multi-service Proxy, https://i.imgur.com/mgtUBgN.png
6th February 2025  , Added support for Smarters Windows                              , Add~, Added support for Smarters Windows executable                                                                                   , Smarters Pro       , https://i.imgur.com/iEb97E1.png
8th February 2025  , Fixed login through Mobile App                                  , Fix~, Fixed login through Mobile app in Smarters Pro v4.0.3+ app                                                                      , Smarters Pro       , https://i.imgur.com/iEb97E1.png
10th February 2025 , Added ability to import Service Data                            , Add~, Added ability to import Service Data in Purple Neu                                                                              , Purple Neu         , https://i.imgur.com/E9dZ2Dn.png
10th February 2025 , Added helper to find Service IDs                                , Add~, Added helper to find Service IDs in Purple Neu                                                                                  , Purple Neu         , https://i.imgur.com/E9dZ2Dn.png
11th February 2025 , Added User & Pass login with Active code                        , Add~, Added User & Pass login with Active code in Purple Neu                                                                          , Purple Neu         , https://i.imgur.com/E9dZ2Dn.png
11th February 2025 , Added Update Log                                                , Add~, Added Update Log to Purple Neu                                                                                                  , Purple Neu         , https://i.imgur.com/E9dZ2Dn.png
12th February 2025 , Added user TMDB Requests                                        , Add~, Added user TMDB Requests to Purple Neu                                                                                          , Purple Neu         , https://i.imgur.com/E9dZ2Dn.png
12th February 2025 , Added user Reports                                              , Add~, Added user Reports to Purple Neu                                                                                                , Purple Neu         , https://i.imgur.com/E9dZ2Dn.png
12th February 2025 , Added Notifications                                             , Add~, Added Notifications to Purple Neu                                                                                               , Purple Neu         , https://i.imgur.com/E9dZ2Dn.png
14th February 2025 , Added support for Intro                                         , Add~, Added support for Intro Video in FCD Box                                                                                        , FCD Box            , https://i.imgur.com/Q0Et9PS.png
14th February 2025 , Added support for VPN                                           , Add~, Added support for VPN in FCD Box                                                                                                , FCD Box            , https://i.imgur.com/Q0Et9PS.png
14th February 2025 , Fixed issue with Additional Services                            , Fix~, Fixed an issue where setting up Multi-dns wouldnt work as expected                                                              , FCD Box            , https://i.imgur.com/Q0Et9PS.png
14th February 2025 , Fixed issue with Intro Video uploading                          , Fix~, Fixed an issue which could sometimes cause an error when uploading an Intro Video                                               , Smarters Pro       , https://i.imgur.com/iEb97E1.png
17th February 2025 , Fixed an issue with updating Category Pin                       , Fix~, Fixed an issue with updating or removing a Category pin in APKTime                                                              , APKTime            , https://i.imgur.com/znijyN4.png
17th February 2025 , Updated graphql to support other endpoints                      , Add~, Updated graphql to support other endpoints in Smarters Pro                                                                      , Smarters Pro       , https://i.imgur.com/iEb97E1.png
17th February 2025 , Added support for get-publisheddata                             , Add~, Added support for get-publisheddata in Smarters Pro                                                                             , Smarters Pro       , https://i.imgur.com/iEb97E1.png
18th February 2025 , Added Downloader Module                                         , Add~, Added support for the Downloader Mods                                                                                           , Downloader         , https://i.imgur.com/cKvEC3w.png
19th February 2025 , Added support for extra endpoints                               , Add~, Added extra endpoint support in Smarters Pro                                                                                    , Smarters Pro       , https://i.imgur.com/iEb97E1.png
19th February 2025 , Added support for Download Enable/Disable                       , Add~, Added support for Download Enable/Disable in Smarters Pro AndyHax 4.0.5 mod                                                     , Smarters Pro       , https://i.imgur.com/iEb97E1.png
22nd February 2025 , Added work-arround for Smarters Windows single/multi issue      , Add~, Added work-arround for Smarters Windows single/multi issue in Smarters Pro                                                      , Smarters Pro       , https://i.imgur.com/iEb97E1.png
25th February 2025 , Updated support for PHP 8.1-8.4+                                , Add~, Updated support for PHP 8.1-8.4 in panel and all modules                                                                        , Cockpit            , https://i.imgur.com/xR0JjJh.png
25th February 2025 , Fixed issue with thumbnails for background selector             , Fix~, Fixed an issue with thumbnails for background selector in panel                                                                 , Cockpit            , https://i.imgur.com/xR0JjJh.png
25th February 2025 , Addded Theme Panel for easier user theme selection              , Add~, Added Theme Panel for easier user theme selection in panel                                                                      , Cockpit            , https://i.imgur.com/xR0JjJh.png
1st March 2025     , Added ShortURL generator to Tools                               , Add~, Added ShortURL generator to Tools for easier sharing of links to customers.                                                     , Cockpit            , https://i.imgur.com/xR0JjJh.png
2nd March 2025     , Added Superadmin toggles for Admin menu items                   , Add~, Added Superadmin toggles for Admin menu items to allow for easier management                                                    , Cockpit            , https://i.imgur.com/xR0JjJh.png
5th March 2025     , Added enabling/disabling Theming from Superadmin                , Add~, Added enabling/disabling Theming from Superadmin to allow for easier management                                                 , Cockpit            , https://i.imgur.com/xR0JjJh.png
5th March 2025     , Added enabling/disabling Theme Tab from Admin                   , Add~, Added enabling/disabling Theme Tab from Admin to allow for easier management                                                    , Cockpit            , https://i.imgur.com/xR0JjJh.png
6th March 2025     , Fixed an issue preventing setting control in Superadmin         , Fix~, Fixed an issue preventing setting control in Superadmin from working as expected.                                               , Cockpit            , https://i.imgur.com/xR0JjJh.png
8th March 2025     , Fixed some issues with uploading Modules                        , Fix~, Fixed some issues with uploading Modules in the Superadmin panel                                                                , Cockpit            , https://i.imgur.com/xR0JjJh.png
9th March 2025     , Added ability to take a backup of Module Settings               , Add~, Added ability to take a backup of Module Settings in the Superadmin panel                                                       , Cockpit            , https://i.imgur.com/xR0JjJh.png
9th March 2025     , Added ability to clear Module user data                         , Add~, Added ability to clear Module user data in the Superadmin panel                                                                 , Cockpit            , https://i.imgur.com/xR0JjJh.png
10th March 2025    , Cleaned up the Panel Modules section of Superadmin              , Fix~, Cleaned up the Panel Modules section of Superadmin to make it easier to manage                                                  , Cockpit            , https://i.imgur.com/xR0JjJh.png
10th March 2025    , Added better directory traversal catching in Module uploading   , Fix~, Fixed traversal attempt catching in Module uploading in the Superadmin panel                                                    , Cockpit            , https://i.imgur.com/xR0JjJh.png
10th March 2025    , Updated CORS proxy throughout the panel and modules             , Fix~, Updated CORS proxy throughout the panel and modules to allow for better handling of requests.                                   , Cockpit            , https://i.imgur.com/xR0JjJh.png
11th March 2025    , Fixed TheSportsDB Top/TV Today images not showing               , Fix~, Fixed an issue which would prevent TheSportsDB Top/TV Today images from showing in the WebViews.                                , Android Webviews   , https://i.imgur.com/N55kp3Z.png
11th March 2025    , Workarround for Sport-tv-gide.live 502 issue                    , Fix~, Added a workarround for the Sport-tv-gide.live 502 issue in the WebViews.                                                       , Android Webviews   , https://i.imgur.com/N55kp3Z.png
11th March 2025    , Switched to Header from cURL in some Webviews for compatability , Fix~, Switched to header from cURL in some Webviews for compatability with more apps.                                                 , Android Webviews   , https://i.imgur.com/N55kp3Z.png
12th March 2025    , Added support for RTX Smarters Pro v2.0TV/1.0Mobile Mods        , Add~, Added support for the RTX Mods version of the Smarters Pro v2.0TV/1.0Mobile app                                                 , Smarters Pro       , https://i.imgur.com/iEb97E1.png
12th March 2025    , Decoupled Windows Executable API for better support             , Fix~, Decoupled Windows Executable API for better support in Smarters Pro                                                             , Smarters Pro       , https://i.imgur.com/iEb97E1.png
13th March 2025    , Added vsdk endpoints to stop 404 errors                         , Add~, Added vsdk endpoints to stop 404 errors in Purple Player                                                                        , Purple Player      , https://i.imgur.com/DIUv5jl.png
15th March 2025    , Added support for PLGUIDE.php in some mods                      , Add~, Added support for 'PLGUIDE.php' in some mods to allow for Ibo 3.9 mods                                                          , IBO Solutions      , https://i.imgur.com/z13H3dJ.png
15th March 2025    , Made sure server id can not be NULL                             , Fix~, Made sure server id can not be NULL in some mods to prevent issues with the panel.                                              , IBO Solutions      , https://i.imgur.com/z13H3dJ.png
15th March 2025    , Re-worked the workarround for 502 sport-tv-guide.live issue     , Fix~, Re-worked the workarround for the 502 sport-tv-guide.live issue in the WebViews.                                                , Android Webviews   , https://i.imgur.com/N55kp3Z.png
15th March 2025    , Re-worked the loading of Custom WebViews throughout             , Fix~, Re-worked the loading of Custom WebViews throughout the panel and modules to allow for better handling of requests.             , Cockpit            , https://i.imgur.com/xR0JjJh.png
15th March 2025    , Replaced default tvsportguide with sport-tv-guide               , Fix~, Replaced default tvsportguide with sport-tv-guide.live in all webviews as its dead.                                             , Cockpit            , https://i.imgur.com/xR0JjJh.png
15th March 2025    , Disabled tvsportguide from Custom WebViews                      , Fix~, Disabled tvsportguide from Custom WebViews as its dead.                                                                         , Cockpit            , https://i.imgur.com/xR0JjJh.png
15th March 2025    , Made it more clear which requests are internal calls            , Fix~, Made it more clear which requests are internal calls in the panel and modules typically WebViews.                               , Cockpit            , https://i.imgur.com/xR0JjJh.png
16th March 2025    , Fixed broken JavaScript in TMDB Layout 21                       , Fix~, Fixed broken JavaScript in Layout 21 in the Android Webviews                                                                    , Android Webviews   , https://i.imgur.com/N55kp3Z.png
16th March 2025    , Show when no service assigned to client                         , Fix~, Show when no service assigned to client in the panel                                                                            , IBO Solutions      , https://i.imgur.com/z13H3dJ.png
16th March 2025    , Fixed tooltips in Purple Module appearance                      , Fix~, Fixed tooltips in Purple Module to show correctly                                                                               , Purple Player      , https://i.imgur.com/DIUv5jl.png
16th March 2025    , Allow jpg/jpeg images to be uploaded                            , Add~, Allow jpg/jpeg images to be uploaded in Purple Player                                                                           , Purple Player      , https://i.imgur.com/DIUv5jl.png
16th March 2025    , Added easier support for NUL (NONX) layout                      , Add~, Added easier support for NUL(NONX) layout in Purple Player                                                                      , Purple Player      , https://i.imgur.com/DIUv5jl.png
16th March 2025    , Added update info in Super Admin                                , Add~, Added update info in Super Admin to show the latest updates in the panel                                                        , Cockpit            , https://i.imgur.com/xR0JjJh.png
18th March 2025    , Hotfix for timed-out thesportsdb requests                       , Fix~, Hotfix for timed-out thesportsdb requests in the Android Webviews                                                               , Android Webviews   , https://i.imgur.com/N55kp3Z.png
19th March 2025    , Fixed editing Appstore                                          , Fix~, Fixed editing Appstore items from table in LTQ2                                                                                 , LTQ2               , https://i.imgur.com/5GYEXZD.png
19th March 2025    , Fixed editing Notitifications                                   , Fix~, Fixed editing Notifications from table in Purple Neu                                                                            , Purple Neu         , https://i.imgur.com/E9dZ2Dn.png
29th March 2025    , Finished cleaning up and refactoring all Modules                , Fix~, Cleaned up and refactored all modules to make them easier to manage and update and added additional security.                   , Cockpit            , https://i.imgur.com/xR0JjJh.png
30th March 2025    , Cleaned up UI in all Modules                                    , Fix~, Cleaned up UI in all modules to make it easier to navigate and use and be more inline with other modules.                       , Cockpit            , https://i.imgur.com/xR0JjJh.png
31st March 2025    , Added Custom CSS to Superadmin                                  , Add~, Added Custom CSS to Superadmin to allow for more indepth customization of the Panel.                                            , Cockpit            , https://i.imgur.com/xR0JjJh.png
31st March 2025    , Added support for Smarters Pro 4.1 rebrands                     , Add~, Added support for Smarters Pro 4.1 rebrands                                                                                     , Smarters Pro       , https://i.imgur.com/iEb97E1.png
1st April 2025     , Added support for RTXSport page in Smarters Pro 2.0             , Add~, Added support for the RTXSport page to Smarters Pro 2.0 mods.                                                                   , Smarters Pro       , https://i.imgur.com/iEb97E1.png
7th April 2025     , Fixed an issue with AndyHax IBO Pro 3.9 login mod               , Fix~, Fixed an issue where null data would be sent to the client list causing issues with the panel UI                                , IBO Solutions      , https://i.imgur.com/z13H3dJ.png
7th April 2025     , Added support for AndyHax IBO Pro 4.3 login mod                 , Add~, Added support for a slightly tweaked version of the Andyhax IBO Pro 4.3 mod                                                     , IBO Solutions      , https://i.imgur.com/z13H3dJ.png
7th April 2025     , Fixed routing issues with AndyHax VU Player 1.7 login mod       , Fix~, Fixed routing issues with the AndyHax VU Player 1.7 login mod preventing it working as expected                                 , VU Player          , https://i.imgur.com/2vX0q4C.png
12th April 2025    , Added more security in checking uploaded files                  , Fix~, Added more security in checking uploaded files to prevent bad actors from uploading malicious files.                            , Cockpit            , https://i.imgur.com/xR0JjJh.png
13th April 2025    , Fixed adding Image URLs in some modules                         , Fix~, Fixed an issue with adding image URLs in some modules which would not work as expected.                                         , Cockpit            , https://i.imgur.com/xR0JjJh.png
14th April 2025    , Checksum & File List checking when adding Modules               , Add~, Added checksum and file list check of Official Modules to prevent bad actors adding extra files to insecure panels.             , Cockpit            , https://i.imgur.com/xR0JjJh.png
15th April 2025    , Addressed some relatively exploitable issues with Base Panel    , Fix~, Addressed some relatively exploitable issues with the base panel and modules to prevent bad actors from exploiting the panel.   , Cockpit            , https://i.imgur.com/xR0JjJh.png
20th April 2025    , Added Two-Factor Authentication                                 , Add~, Added Two-Factor Authentication to the panel for better security.                                                               , Cockpit            , https://i.imgur.com/xR0JjJh.png
21st April 2025    , Updated System for Modern PHP                                   , Fix~, Upgraded system to work with latest PHP version for better security and performance.                                            , Cockpit            , https://i.imgur.com/xR0JjJh.png
25th April 2025    , Improved User Notifications                                     , Add~, Added modern notification system to replace pop-up alerts for better user experience.                                           , Cockpit            , https://i.imgur.com/xR0JjJh.png
28th April 2025    , Enhanced Error Messages                                         , Fix~, Better error handling with clearer messages throughout all sections.                                                            , Cockpit            , https://i.imgur.com/xR0JjJh.png
2nd May 2025       , Improved Dashboard Analytics                                    , Fix~, Better filtering of page views for more accurate dashboard statistics.                                                          , Cockpit            , https://i.imgur.com/xR0JjJh.png
5th May 2025       , Enhanced Help Documentation                                     , Add~, Updated help sections with more detailed and specific information for better user guidance.                                     , Cockpit            , https://i.imgur.com/xR0JjJh.png
10th May 2025      , Improved Data Management                                        , Fix~, More efficient operations for faster app and category management.                                                               , Cockpit            , https://i.imgur.com/xR0JjJh.png
18th May 2025      , Improved Category Management                                    , Fix~, Better handling of categories and PIN codes for organized content.                                                              , Cockpit            , https://i.imgur.com/xR0JjJh.png
20th May 2025      , Enhanced Store Management                                       , Fix~, Improved store creation with better organization and app association.                                                           , Cockpit            , https://i.imgur.com/xR0JjJh.png
