22nd June 2024     , Fixed issue with saving Purple Player images                    , Fix~, Fixed an issue where by uploading images would redirect to the wrong file.                                                      , Purple Player      , https://i.imgur.com/DIUv5jl.png
22nd June 2024     , Added optional WebViews for Smarters Pro                        , Add~, Can now choose the sports WebViews to use with Smarters Pro                                                                     , Smarters Pro       , https://i.imgur.com/iEb97E1.png
23rd June 2024     , Added option to disable Storefronts                             , Add~, Added option to disable Storefronts in the superadmin settings.                                                                 , Cockpit            , https://i.imgur.com/xR0JjJh.png
23rd June 2024     , Updated TiviMate 399 (3501) API                                 , Fix~, Updated TiviMate 399 (3501) API to fix issues with not connecting to application.                                               , TiviMate           , https://i.imgur.com/uRg0UxZ.png
24th June 2024     , Fixed Layout 4 (OTR Layout)                                     , Fix~, Fixed selecting Layout 4 (OTR Layout) in the XCIPTV Panel                                                                       , XCIPTV             , https://i.imgur.com/piaorjB.png
25th June 2024     , Fixed Remote Update & Redirect                                  , Fix~, Fixed an issue preventing the Remote Update & Redirect settings for Smarters Pro from saving as expected                        , Smarters Pro       , https://i.imgur.com/iEb97E1.png
25th June 2024     , Fixed typo in Purple Panel                                      , Fix~, Fixed typo in Purple Panel which prevented images from being saved correctly.                                                   , Purple Player      , https://i.imgur.com/DIUv5jl.png
25th June 2024     , Fixed DB schema for XCIPTV OVPNs                                , Fix~, Fixed DB Schema for XCTIPV OVPNs to fix issues with entries being added being overwritten                                       , XCIPTV             , https://i.imgur.com/piaorjB.png
25th June 2024     , Prevented Cockpit Storefront re-adding                          , Fix~, Prevented Cockpit Storefront from re-adding itself to the database after deleting.                                              , Cockpit            , https://i.imgur.com/xR0JjJh.png
25th June 2024     , Tickets now only visible to Superadmin                          , Fix~, Prevented users from seeing tickets in the Cockpit settings menu.                                                               , Cockpit            , https://i.imgur.com/xR0JjJh.png
25th June 2024     , Added ability to customize branding                             , Add~, Added ability to customize branding in super admin panel                                                                        , Cockpit            , https://i.imgur.com/xR0JjJh.png
26th June 2024     , Added Support for StreamBox Mobile Pro                          , Add~, Added support for StreamBox Mobile Pro and updated API for StreamBox                                                            , StreamBox          , https://i.imgur.com/qHBgnHI.png
27th June 2024     , Fixed issue with deleting Smarters Pro OVPN                     , Fix~, Fixed an issue where users couldnt delete OVPNs from the Smarters Pro OVPN page.                                                , Smarters Pro       , https://i.imgur.com/iEb97E1.png
28th June 2024     , Fixed issue with TiviMate Sports                                , Fix~, Fixed an issue where the TiviMate Sports page would not load as expected.                                                       , TiviMate           , https://i.imgur.com/uRg0UxZ.png
26th June 2024     , Added Support for StreamBox v8-API                              , Add~, Added support for StreamBox v8 API (app v2.0.0+)                                                                                , StreamBox          , https://i.imgur.com/qHBgnHI.png
1st July 2024      , Fixed issue with Smarters Pro API                               , Fix~, Fixed an issue with Smarters Pro Sports API                                                                                     , Smarters Pro       , https://i.imgur.com/iEb97E1.png
1st July 2024      , Fixed issue with NexTv IPTV APi                                 , Fix~, Fixed an issue with NexTv IPTV API                                                                                              , NexTv IPTV         , https://i.imgur.com/PkmigBn.png
2nd July 2024      , Added support for AndyHax IBO Player Pro mod                    , Fix~, Added support for AndyHaxs IBO Player Pro 3.8 mod                                                                               , IBO Solutions      , https://i.imgur.com/z13H3dJ.png
3rd July 2024      , Added support for more Smarters Pro Mods                        , Add~, Added support for more WHMCS Smarters Pro v4 Modded apps                                                                        , Smarters Pro       , https://i.imgur.com/iEb97E1.png
4th July 2024      , Fixed issue with Smarters Pro remote images API                 , Fix~, Credit to @FTSOL for fix with Smarters Pro remote logo and background                                                           , Smarters Pro       , https://i.imgur.com/iEb97E1.png
6th July 2024      , Added Manual Module Update Checking                             , Add~, Superadmin can now manually check for updates for modules via the Superadmin page                                               , Cockpit            , https://i.imgur.com/xR0JjJh.png
6th July 2024      , Added Automatic Module Updating                                 , Add~, Modules will now check for updates every 24 hours and update automatically                                                      , Cockpit            , https://i.imgur.com/xR0JjJh.png
6th July 2024      , Added support for Smarters Pro 1.9.2 Mod                        , Add~, Added support for RTX Mods Smarters Pro 1.9.2                                                                                   , Smarters Pro       , https://i.imgur.com/iEb97E1.png
6th July 2024      , Reworked support for WebViews                                   , Fix~, Reworked support for WebViews in Smarters Pro allowing selection of alternating backgrounds and images                          , Smarters Pro       , https://i.imgur.com/iEb97E1.png
6th July 2024      , Fixed IBO Sol. Register page for clients                        , Fix~, Fixed an issue with the register page for clients to add their playlists in IBO Sol. module                                     , IBO Solutions      , https://i.imgur.com/z13H3dJ.png
11th July 2024     , Added support for AndyHad IBO Player Pro 3.9                    , Add~, Added some extra bits to support the extras added to AndyHaxs IBO Player Pro 3.9 mod.                                           , IBO Solutions      , https://i.imgur.com/z13H3dJ.png
12th July 2024     , Updated support for ionCube Loaders 13.0.2                      , Add~, Updated support for ionCube Loaders 13.0.2 in panel and all modules                                                             , Cockpit            , https://i.imgur.com/xR0JjJh.png
13th July 2024     , Fixed Notifications on Panel                                    , Fix~, Fixed the ability to enable/disable notifications for users and admins can change the API Endpoint for notifications.           , Cockpit            , https://i.imgur.com/xR0JjJh.png
14th July 2024     , Changed Purple Player Layout Select                             , Fix~, Layout select now only shows what Layouts are set in settings in Theme Change Layout.                                           , Purple Player      , https://i.imgur.com/DIUv5jl.png
14th July 2024     , Added AndyHax Layout6 WebView                                   , Add~, Added support for AndyHaxs Layout6 WebView for IBO Player Pro 3.9                                                               , IBO Solutions      , https://i.imgur.com/z13H3dJ.png
15th July 2024     , Fixed Parental Pin for AH Mods                                  , Fix~, Fixed an issue with the query for setting Parental Pin with the AndyHax Mods of IBO Player Pro                                  , IBO Solutions      , https://i.imgur.com/z13H3dJ.png
16th July 2024     , Added spinner to WebViews                                       , Add~, Added a loading spinner to the WebView pages to show the WebView is loading                                                     , Android Webviews   , https://i.imgur.com/N55kp3Z.png
17th July 2024     , Added more security features to panel                           , Add~, Added an extra layer of security to the panel                                                                                   , Cockpit            , https://i.imgur.com/xR0JjJh.png
18th July 2024     , Fixed an issue with API Help                                    , Fix~, Fixed an issue always showing http protocol in API Help URLs                                                                    , Cockpit            , https://i.imgur.com/xR0JjJh.png
19th July 2024     , Added ability to remove Modules from panel                      , Add~, Added a feature to remove modules from a panel via the Super Admin panel                                                        , Cockpit            , https://i.imgur.com/xR0JjJh.png
19th July 2024     , Increased the idle timer to 3hrs                                , Fix~, Increased the idle timer to 3 hours instead of 15 minutes before logging out                                                    , Cockpit            , https://i.imgur.com/xR0JjJh.png
20th July 2024     , Reworked Stremio Addons                                         , Fix~, Reworked Strsemio Addons updating on login to work faster                                                                       , Stremio            , https://i.imgur.com/546Gr2o.png
23rd July 2024     , Updated Imgur Image Uploading API                               , Fix~, Fixed Imgur Image Uploading for Smarters Pro/Webviews/Purple Player and StreamBox and added Visual Feedback when uploading.     , Cockpit            , https://i.imgur.com/xR0JjJh.png
21st July 2024     , Fixed an issue with OVPNs                                       , Fix~, Fixed an issue with the function for Country Codes in OVPN Tables                                                               , Cockpit            , https://i.imgur.com/xR0JjJh.png
24th July 2024     , Fixed issue with Deleting OVPNs                                 , Fix~, Fixed an issue preventing OVPNs from being deleted in Smarters Pro Panel                                                        , Smarters Pro       , https://i.imgur.com/iEb97E1.png
26th July 2024     , Fixed an issue with Purple Player                               , Fix~, Fixed an issue with Purple Player panel causing panel to lock up when editing VPNs                                              , Purple Player      , https://i.imgur.com/DIUv5jl.png
28th July 2024     , Fixed an issue with Removing services in IBO Sol.               , Fix~, Fixed an issue with IBO Solultions panel when removing a service would leave users with null values instead of removing them    , IBO Solutions      , https://i.imgur.com/z13H3dJ.png
2nd August 2024    , Added 1-Stream Player Panel                                     , Add~, Added support for the RTX Mods version of the 1-Stream Player applicaiton                                                       , 1-Stream Player    , https://i.imgur.com/NC7ceih.png
2nd August 2024    , Added 9Xtream Panel                                             , Add~, Added support for the RTX Mods version of the 9Xtream application                                                               , 9Xtream            , https://i.imgur.com/1BuEnVi.png
4th August 2024    , Added MYTVOnline Panel                                          , Add~, Added support for clone mod version of the MYTVOnline application                                                               , MYTVOnline         , https://i.imgur.com/CNAz8Pa.png
5th August 2024    , Added Legazy Systems Panel                                      , Add~, Added support for LEGAZY SYSTEMS IPTV applications                                                                              , Legazy Systems     , https://i.imgur.com/vqtIr1x.png
9th August 2024    , Fixed an issue with IBO Solutions API                           , Fix~, Fixed a bug introduced which prevented the IBO Solutions API from working as expected.                                          , IBO Solutions      , https://i.imgur.com/z13H3dJ.png
9th August 2024    , Fixed seperation of AH3.8/3.9 themes                            , Fix~, Fixed the seperation of theme selecting for AndyHax 3.8 and 3.9 apps in IBO Solutions panel                                     , IBO Solutions      , https://i.imgur.com/z13H3dJ.png
9th August 2024    , Fixed the uploading of Modules via panel                        , Fix~, Fixed issues with uploading modules via the panel which prevented files from being unzipped properly.                           , Cockpit            , https://i.imgur.com/xR0JjJh.png
9th August 2024    , Licence is now passed in Module Updates                         , Add~, Made it so existing licences are passed onto updates to users dont have to re enter their licences on updates.                  , Cockpit            , https://i.imgur.com/xR0JjJh.png
9th August 2024    , Fixed an issue with Module updating                             , Fix~, Fixed an issue which sometimes left empty .zip archives in the file directory when an update didnt work or was cancelled.       , Cockpit            , https://i.imgur.com/xR0JjJh.png
9th August 2024    , Fixed an issue with ads.php                                     , Fix~, Fixed an issue with official Smarters json responses for ads                                                                    , Smarters Pro       , https://i.imgur.com/iEb97E1.png
9th August 2024    , Fixed an issue with Smarters proxy                              , Fix~, Fixed an issue which prevented some services from being unable to use the proxy api in Smarters Pro                             , Smarters Pro       , https://i.imgur.com/iEb97E1.png
9th August 2024    , Fixed an issue with Multi-service Proxy                         , Fix~, Fixed an issue which prevented some services from being unable to use the proxy api in Multi-service Proxy                      , Multi-service Proxy, https://i.imgur.com/mgtUBgN.png
9th August 2024    , Fixed an issue with TiviMate Proxy                              , Fix~, Fixed an issue which prevented some services from being unable to use the proxy api in TiviMate                                 , TiviMate           , https://i.imgur.com/uRg0UxZ.png
11th August 2024   , Swapped CORS Proxy for Multi-service Proxy                      , Fix~, Swapped the CORS Proxy for the Multi-service Proxy to allow for testing of insecure services.                                   , Multi-service Proxy, https://i.imgur.com/mgtUBgN.png
12th August 2024   , Added APKTime Panel                                             , Add~, Added support for APKTime store appstore panel                                                                                  , APKTime            , https://i.imgur.com/znijyN4.png
13th August 2024   , Updated API for IPTV Smarters Pro v4                            , Add~, Added support for newer v4 mods of IPTV Smarters Pro                                                                            , Smarters Pro       , https://i.imgur.com/iEb97E1.png
13th August 2024   , Added SmartTube Panel                                           , Add~, Added support for the RTX Mods version of the SmartTube application                                                             , SmartTube          , https://i.imgur.com/dOjhvLv.png
15th August 2024   , Fixed editing apps in APKTime Panel                             , Fix~, Fixed an issue which prevented users from editing apps in the APKTime Panel                                                     , APKTime            , https://i.imgur.com/znijyN4.png
16th August 2024   , Added AppLinked Panel                                           , Add~, Added support for the AppLinked store application panel                                                                         , AppLinked          , https://i.imgur.com/QNose6V.png
18th August 2024   , Added LTQ2 Panel                                                , Add~, Added support for LTQ2 application panel                                                                                        , LTQ2               , https://i.imgur.com/5GYEXZD.png
18th August 2024   , Fixed adding TMDB Keys to CinemaHD                              , Fix~, Fixed an issue with adding TMDB Keys to CinemaHD panel                                                                          , CinemaHD           , https://i.imgur.com/ryHBvdy.png
18th August 2024   , Fixed issued with TiviMate Proxy                                , Fix~, Fixed an issue with the TiviMate Proxy API from working as expected with some services.                                         , TiviMate           , https://i.imgur.com/uRg0UxZ.png
20th August 2024   , Added welcomestatus to api for Smarters Pro                     , Add~, Added support for Welcome Status API in some new Smarters Pro v4 APIs                                                           , Smarters Pro       , https://i.imgur.com/iEb97E1.png
20th August 2024   , Fixed an issue with get_lastupdate for Smarters Pro             , Fix~, Fixed an issue with get_lastupdate API which prevented message/image Ads from showing properly in app.                          , Smarters Pro       , https://i.imgur.com/iEb97E1.png
20th August 2024   , Fixed an issue with Maintenance Mode                            , Fix~, Fixed an issue preventing Maintenance message from saving properly in panel.                                                    , Smarters Pro       , https://i.imgur.com/iEb97E1.png
20th August 2024   , Fixed ?/Android endpoint for Smarters Pro                       , Fix~, Fixed htaccess for the standard /?/Android endpoint to work as expected.                                                        , Smarters Pro       , https://i.imgur.com/iEb97E1.png
20th August 2024   , Added suppliment graphql endpoint                               , Add~, Added graphql.php endpoint for some Smarters Pro apps which use AWS GraphQL                                                     , Smarters Pro       , https://i.imgur.com/iEb97E1.png
21st August 2024   , Added better rules to htaccess for Smarters Pro                 , Add~, Added better handling of different endpoints for different types of official and modded apps to add further support.            , Smarters Pro       , https://i.imgur.com/iEb97E1.png
21st August 2024   , Added extra API for VPNs in Smarters Pro                        , Add~, Added the updated VPNs API for the newer Smarters Pro v4 apps.                                                                  , Smarters Pro       , https://i.imgur.com/iEb97E1.png
21st August 2024   , Fixed Intro Video uploading                                     , Fix~, Prevented caching of old Intro video to show the latest uploaded video asoon as uploaded.                                       , Smarters Pro       , https://i.imgur.com/iEb97E1.png
21st August 2024   , Fixed issue with Sparkle WebViews                               , Fix~, Fixed an issue preventing RTX Mods of Sparkle working as indented with WebViews.                                                , Sparkle TV         , https://i.imgur.com/qKEbeXG.png
25th August 2024   , Fixed issue with Sparkle WebViews                               , Fix~, Fixed an issue preventing RTX Mods of Sparkle working as indented with WebViews. (Fixed this time.)                             , Sparkle TV         , https://i.imgur.com/qKEbeXG.png
25th August 2024   , Fixed issue with sport Webview in panel                         , Fix~, Fixed an issue preventing the sport WebView selector from being viewable in the panel.                                          , Sparkle TV         , https://i.imgur.com/qKEbeXG.png
25th August 2024   , Added support for AH Mods                                       , Add~, Added Support for some AndyHax Mods API for NextTV IPTV                                                                         , NextTV IPTV        , https://i.imgur.com/PkmigBn.png
26th August 2024   , Fixed an issue with StreamBox API                               , Fix~, Fixed an issue preventing StreamBox API from working as expected.                                                               , StreamBox          , https://i.imgur.com/qHBgnHI.png
2nd September 2024 , Fixed htaccess in Smarters Pro                                  , Fix~, Fixed issues relating to the htaccess file in Smarters Pro panel.                                                               , Smarters Pro       , https://i.imgur.com/iEb97E1.png
2nd September 2024 , Added support for RTX 2.9.2r Mod                                , Add~, Added support for the RTX Mods version of Flix Vision 2.9.2r                                                                    , Flix Vision        , https://i.imgur.com/CQxNJjK.png
3rd September 2024 , Fixed htaccess in IBO SOl.                                      , Fix~, Fixed issues relating to the htaccess file in IBO Solutions panel.                                                              , IBO Solutions      , https://i.imgur.com/z13H3dJ.png
3rd September 2024 , Added support for AH VU Player 1.7 Mod                          , Add~, Added support for AndyHaxs VU Player 1.7 mod.                                                                                   , IBO Solutions      , https://i.imgur.com/z13H3dJ.png
3rd September 2024 , Fixed uploading in Design tab                                   , Fix~, Fixed uploading images and video in the Design tab of XCIPTV                                                                    , XCIPTV             , https://i.imgur.com/piaorjB.png
10th September 2024, Added support for RTX IBO 3.9 Mod                               , Add~, Added support for the RTX Mods ultimate version of IBO 3.9.                                                                     , IBO Solutions      , https://i.imgur.com/z13H3dJ.png
11th September 2024, Updated the MAC Address entry                                   , Fix~, Updated the MAC Address entry format to match the selection of the MAC Length when using RTX 3.9 API setting                    , IBO Solutions      , https://i.imgur.com/z13H3dJ.png
12th September 2024, Added support for Active Codes                                  , Add~, Added support for the Active Codes API for RTX 3.9 IBO Solutions                                                                , IBO Solutions      , https://i.imgur.com/z13H3dJ.png
15th September 2024, Added Clear Visitors Button                                     , Add~, Added  a button to clear the visitors list in the superadmin panel.                                                             , Cockpit            , https://i.imgur.com/xR0JjJh.png
15th September 2024, Fixed Currencies in Storefronts                                 , Fix~, Fixed an issue which would show the wrong currency in the storefronts no matter the selected setting.                           , Cockpit            , https://i.imgur.com/xR0JjJh.png
15th September 2024, Branding now shows in Page Title                                , Add~, Made it so the Branding Text now shows as the prefix of the Page Title for Cockpit Base pages.                                  , Cockpit            , https://i.imgur.com/xR0JjJh.png
17th September 2024, Added extra Mod endpoints                                       , Add~, Added extra endpoints for Smarters Pro to support more mods                                                                     , Smarters Pro       , https://i.imgur.com/iEb97E1.png
17th September 2024, Show Maximum upload size allowed                                , Add~, Now show the Maximum upload size allowed under the Video for custom files                                                       , Smarters Pro       , https://i.imgur.com/iEb97E1.png
17th September 2024, Fixed issue with displaying Logo and Background                 , Fix~, Fixed an issue which would prevent the logo and background from being displayed in the app.                                     , Smarters Pro       , https://i.imgur.com/iEb97E1.png
17th September 2024, Fixed sort-by State/Location                                    , Fix~, Fixed sort-by state/location in XCIPTV                                                                                          , XCIPTV             , https://i.imgur.com/piaorjB.png
17th September 2024, Updated Visitor Logs data entries                               , Fix~, Updated the Visitor logs to properly source the data using the IP address of the user for the statistics                        , Cockpit            , https://i.imgur.com/xR0JjJh.png
18th September 2024, Added enable/disable Automatic module updates                   , Add~, Added ability to enable and disable automatic module updates - defaulting to disabled.                                          , Cockpit            , https://i.imgur.com/xR0JjJh.png
