19th September 2024, Added branding Text to Login page                               , Add~, If set - the branding text will display on the Login page.                                                                      , Cockpit            , https://i.imgur.com/xR0JjJh.png
19th September 2024, Added branding Image to Login page                              , Add~, If set - the branding image will display on the Login page.                                                                     , Cockpit            , https://i.imgur.com/xR0JjJh.png
20th September 2024, Added support for iMPlayer 3.7.5 mod                            , Add~, Added support for the 3.7.5 mod of iMPlayer TV                                                                                  , iMPlayer TV        , https://i.imgur.com/88ScGTg.png
24th September 2024, Added support for Login with Mobile                             , Add~, Added support for Login with Mobile for Smarters Pro v4.0.3+ app                                                                , Smarters Pro       , https://i.imgur.com/iEb97E1.png
24th September 2024, Added support for remote updating                               , Add~, Added support for remote updating of Smarters Pro v4.0.3+ app                                                                   , Smarters Pro       , https://i.imgur.com/iEb97E1.png
25th September 2024, Updated support for ionCube Loaders 13.0.3                      , Add~, Updated support for ionCube Loaders 13.0.3 in panel and all modules                                                             , Cockpit            , https://i.imgur.com/xR0JjJh.png
25th September 2024, Fixed bugs introduced                                           , Fix~, Fixed bugs introduced in the new API endpoints for Smarters Pro v4.0.3+ app                                                     , Smarters Pro       , https://i.imgur.com/iEb97E1.png
27th September 2024, Added support for External Apps                                 , Add~, Added support for external apps in 3.7.5 mod of iMPlayer TV                                                                     , iMPlayer TV        , https://i.imgur.com/88ScGTg.png
28th September 2024, Fixed all .htaccess                                             , Fix~, Fixed all .htaccess files to be more secure.                                                                                    , Cockpit            , https://i.imgur.com/xR0JjJh.png
1st October 2024   , Fixed deleting Banners                                          , Fix~, Fixed deleting banners in LTQ2 panel                                                                                            , LTQ2               , https://i.imgur.com/5GYEXZD.png
1st October 2024   , Added Panel Title to Breadcrumbs                                , Add~, Added the Panel Title to the Breadcrumbs                                                                                        , Cockpit            , https://i.imgur.com/xR0JjJh.png
1st October 2024   , Fixed drop down menus                                           , Fix~, Fixed the drop down menus to have a default text when no option is selected                                                     , AppLinked          , https://i.imgur.com/QNose6V.png
1st October 2024   , Fixed drop down menus                                           , Fix~, Fixed the drop down menus to have a default text when no option is selected                                                     , APKTime            , https://i.imgur.com/znijyN4.png
1st October 2024   , Clear Stremio key cache after 2 weeks                           , Add~, Added a new setting to clear the Stremio key cache after 2 weeks. This is to prevent the cache from growing too large.          , Stremio            , https://i.imgur.com/546Gr2o.png
1st October 2024   , Removed error prone addons                                      , Fix~, Removed some default addons which are prone to errors causing issues with clients logging in                                    , Stremio            , https://i.imgur.com/546Gr2o.png
2nd October 2024   , Added Background Images to panel                                , Add~, Allow for up to 8 selectable Images to be displayed in the background of the panel from the Settings page                       , Cockpit            , https://i.imgur.com/xR0JjJh.png
2nd October 2024   , Added extra endpoints to XCIPTV                                 , Add~, Added extra endpoints to XCIPTV to support more mods                                                                            , XCIPTV             , https://i.imgur.com/piaorjB.png
2nd October 2024   , Added support for Cloud Backup feature                          , Add~, Added support for the Cloud Backup feature in the app                                                                           , XCIPTV             , https://i.imgur.com/piaorjB.png
4th October 2024   , Login redirect after timeout                                    , Add~, When logged out after time out - login will redirect to the page you were logged out from                                       , Cockpit            , https://i.imgur.com/xR0JjJh.png
6th October 2024   , Fixed deleting services                                         , Fix~, Fixed deleting services in iMPlayer TV panel                                                                                    , iMPlayer TV        , https://i.imgur.com/88ScGTg.png
7th October 2024   , Added optional reCaptcha v2 to Login                            , Add~, Added optional reCaptcha v2 to Login Page                                                                                       , Cockpit            , https://i.imgur.com/xR0JjJh.png
10th October 2024  , CustomWebviews overhaul                                         , Fix~, Overhauled CustomWebviews to allow for more customisation and easier management.                                                , Android Webviews   , https://i.imgur.com/N55kp3Z.png
10th October 2024  , Updated WebViews                                                , Fix , Updated WebViews for XCIPTV module                                                                                              , XCIPTV             , https://i.imgur.com/piaorjB.png
10th October 2024  , Updated WebViews                                                , Fix~, Updated WebViews for IBO Sol. RTX Mods API to support updated WebViews                                                          , IBO Solutions      , https://i.imgur.com/z13H3dJ.png
10th October 2024  , Reenabled Layouts/Themes                                        , Add~, Reenabled layouts and themes in IBO Sol. RTX Mods API to support updated WebViews                                               , IBO Solutions      , https://i.imgur.com/z13H3dJ.png
10th October 2024  , Updated WebViews                                                , Fix~, Updated WebViews for LTQ2 module                                                                                                , LTQ2               , https://i.imgur.com/5GYEXZD.png
10th October 2024  , Updated WebViews                                                , Fix~, Updated WebViews for Purple Player module                                                                                       , Purple Player      , https://i.imgur.com/DIUv5jl.png
10th October 2024  , Updated WebViews                                                , Fix~, Updated WebViews for Smarters Pro module                                                                                        , Smarters Pro       , https://i.imgur.com/iEb97E1.png
10th October 2024  , Updated WebViews                                                , Fix~, Updated WebViews for Sparkle TV module                                                                                          , Sparkle TV         , https://i.imgur.com/qKEbeXG.png
10th October 2024  , Updated WebViews                                                , Fix~, Updated WebViews for TiviMate module                                                                                            , TiviMate           , https://i.imgur.com/uRg0UxZ.png
11th October 2024  , Updated Manual Ads                                              , Fix~, Updated Ads in Smarters Pro to merge with the Slideshow WebView when added                                                      , Smarters Pro       , https://i.imgur.com/iEb97E1.png
12th October 2024  , Fixed mixing images and video                                   , Fix~, Fixed mixing Video and Images in the Media Slideshow WebView                                                                    , Android Webviews   , https://i.imgur.com/N55kp3Z.png
12th October 2024  , Fixed issue adding remote url                                   , Fix~, Fixed an issue preventing the user returning to the correct page after adding a remote URL in Media Slideshow WebView           , Android Webviews   , https://i.imgur.com/N55kp3Z.png
13th October 2024  , Fixed issues with some TMDB WebViews                            , Fix~, Fixed issues with some TMDB WebViews                                                                                            , Android Webviews   , https://i.imgur.com/N55kp3Z.png
14th October 2024  , Updated support for ionCube Loaders 14.0.0                      , Add~, Updated support for ionCube Loaders 14.0.0 in panel and all modules                                                             , Cockpit            , https://i.imgur.com/xR0JjJh.png
14th October 2024  , Added TheSportsDB: League Table WebView                         , Add~, Added TheSportsDB: League Table WebView                                                                                         , Android Webviews   , https://i.imgur.com/N55kp3Z.png
15th October 2024  , Added TheSportsDB: League Cards WebView                         , Add~, Added TheSportsDB: Fixtures WebView                                                                                             , Android Webviews   , https://i.imgur.com/N55kp3Z.png
16th October 2024  , Added Websites WebView                                          , Add~, Added Websites webview to allow users to point to their own hosted webviews                                                     , Android Webviews   , https://i.imgur.com/N55kp3Z.png
17th October 2024  , Fixed TMDB Webviews 15/16/17/18 and 19                          , Fix~, Fixed Webviews 15/16/17/18 and 19                                                                                               , Android Webviews   , https://i.imgur.com/N55kp3Z.png
18th October 2024  , Added FramedViews 1 & 2 WebViews                                , Add~, Added FramedViews 1 & 2 WebViews                                                                                                , Android Webviews   , https://i.imgur.com/N55kp3Z.png
19th October 2024  , Added FramedViews 3 WebView                                     , Add~, Added FramedViews 3 & 4 WebViews                                                                                                , Android Webviews   , https://i.imgur.com/N55kp3Z.png
20th October 2024  , Added AndyHax TMDB Webviews 20 & 21                             , Add~, Added AndyHax TMDB Webviews 20 & 21                                                                                             , Android Webviews   , https://i.imgur.com/N55kp3Z.png
20th October 2024  , Added Silenc_e_r TMDB Webview 22                                , Add~, Added Silenc_e_r TMDB Webview 22                                                                                                , Android Webviews   , https://i.imgur.com/N55kp3Z.png
21st October 2024  , Fixed decoupling issue with services                            , Fix~, Fixed an issue which would decouple users from selected services when edited in IBO Sol                                         , IBO Solutions      , https://i.imgur.com/z13H3dJ.png
21st October 2024  , Added View Fullscreen button                                    , Add~, Added View Fullscreen button the all the WebViews to give more idea of what can be expected in app.                             , Android Webviews   , https://i.imgur.com/N55kp3Z.png
23rd October 2024  , Added QR Code Generator to tools                                , Add~, Added QR Code Generator to tools for easier serving of links to customers.                                                      , Cockpit            , https://i.imgur.com/xR0JjJh.png
24th October 2024  , Fixed issue with protocol_check in IBO SOl.                     , Fix~, Fixed an issue which would cause the protocol_check to fail when using IBO Sol.                                                 , IBO Solutions      , https://i.imgur.com/z13H3dJ.png
25th October 2024  , Added all TheSportsDB Leagues to dropdown                       , Add~, Added all TheSportsDB Leagues to dropdown for the Leagues WebViews                                                              , Android Webviews   , https://i.imgur.com/N55kp3Z.png
28th October 2024  , Fixed issues with WebViews                                      , Fix~, Fixed issues with WebViews not working as expected.                                                                             , Sparkle TV         , https://i.imgur.com/qKEbeXG.png
28th October 2024  , Added support for RTX Mods v2.0.1                               , Add~, Added support for the RTX Mods version of the 2.0.1 app                                                                         , Sparkle TV         , https://i.imgur.com/qKEbeXG.png
28th October 2024  , Fixed issues with some WebViews                                 , Fix~, Fixed issues with some WebViews not working as expected.                                                                        , IBO Solutions      , https://i.imgur.com/z13H3dJ.png
30th October 2024  , Added support for Easy Player                                   , Add~, Added support for Easy Player mods with XCodes and Codes                                                                        , Easy Player        , https://i.imgur.com/etTrMvy.png
31st October 2024  , Added support for Remote images                                 , Add~, Added support for Remote images in Easy Player panel                                                                            , Easy Player        , https://i.imgur.com/etTrMvy.png
31st October 2024  , Added support for Announcements                                 , Add~, Added support for Announcements in Easy Player panel                                                                            , Easy Player        , https://i.imgur.com/etTrMvy.png
31st October 2024  , Fixed issue with deleting Annoucements                          , Fix~, Fixed issue with deleting Announcements                                                                                         , Easy Player        , https://i.imgur.com/etTrMvy.png
1st November 2024  , Updated support for ionCube Loaders 14.0.1                      , Add~, Updated support for ionCube Loaders 14.0.1 in panel and all modules                                                             , Cockpit            , https://i.imgur.com/xR0JjJh.png
3rd November 2024  , Added support for ORVPN                                         , Add~, Added support for ORVPN (XCIPTV Standalone VPN)                                                                                 , OTRVPN             , https://i.imgur.com/OBzevBe.png
4th November 2024  , Fixed issues with depreciated functions                         , Fix~, Fixed an issue in various places where depreciated functions were used.                                                         , Cockpit            , https://i.imgur.com/xR0JjJh.png
5th November 2024  , Added support for Purple Neu                                    , ~Add, Added support for Purple Neu Active Code                                                                                        , Purple Neu         , https://i.imgur.com/E9dZ2Dn.png
6th November 2024  , Fixed an issue with Dashboard Stats                             , Fix~, Fixed an issue which would always default to 'Cockpit Panel' instead of the correct App being used.                             , Cockpit            , https://i.imgur.com/xR0JjJh.png
7th November 2024  , Fixed an issue with Visitor Logs                                , Fix~, Fixed various issues with Visitor Logs - especially when panel used by larger service providers.                                , Cockpit            , https://i.imgur.com/xR0JjJh.png
8th November 2024  , Added support for RTX3.2.7                                      , Add~, Added support for NexTv IPTV RTX3.2.7                                                                                           , NexTv IPTV         , https://i.imgur.com/PkmigBn.png
9th November 2024  , Added Clear User Cache button                                   , Add~, Added Clear User Cache button to Stremio panel for oversized caches early trimming.                                             , Stremio            , https://i.imgur.com/546Gr2o.png
9th November 2024  , Fixed issue with Announcements                                  , Fix~, Fixed an issue with Announcements not working as expected.                                                                      , Easy Player        , https://i.imgur.com/etTrMvy.png
9th November 2024  , Added support for Smarters Windows                              , Add~, Added support for Smarters Windows executable                                                                                   , Smarters Pro       , https://i.imgur.com/iEb97E1.png
9th November 2024  , IBO Sol. Silenc_e_r Polish Translation                          , Fix~, Silenc_e_r updated the Polish Translation for IBO Solutions                                                                     , IBO Solutions      , https://i.imgur.com/z13H3dJ.png
10th November 2024 , Added TheSportsDB.com API Key back                              , Fix~, Re-enabled setting your own API Key for TheSportsDB.com in the panel                                                            , Android Webviews   , https://i.imgur.com/N55kp3Z.png
12th November 2024 , Fixed issue with FramedViews                                    , Fix~, Fixed an issue which could stop Framedviews from working in apps as expected.                                                   , Android Webviews   , https://i.imgur.com/N55kp3Z.png
13th November 2024 , Fixed issue with Editing Lang                                   , Fix~, Fixed an issue with editing Languages in the IBO Sol. panel                                                                     , IBO Solutions      , https://i.imgur.com/z13H3dJ.png
13th November 2024 , Fixed issue with Superadmin                                     , Fix~, Fixed an issue which would allow non superadmin to get into the superadmin page.                                                , Cockpit            , https://i.imgur.com/xR0JjJh.png
15th November 2024 , Added Expirey to Active Codes                                   , Add~, Added Expirey to Active Codes                                                                                                   , Purple Neu         , https://i.imgur.com/E9dZ2Dn.png
15th November 2024 , Added Search to Active Codes table                              , Add~, Added Search to Active Codes table                                                                                              , Purple Neu         , https://i.imgur.com/E9dZ2Dn.png
15th November 2024 , Fixed issue with Settings                                       , Fix~, Fixed an issue preventing settings for Admin account saving                                                                     , Cockpit            , https://i.imgur.com/xR0JjJh.png
15th November 2024 , Added Polish Ekstraklasa                                        , Add~, Added Polish Ekstraklasa to TheSportsDB dropdown manually                                                                       , Android Webviews   , https://i.imgur.com/N55kp3Z.png
15th November 2024 , Fixed issues with Purple Player App Video                       , Fix~, Fixed issues with Purple Player uploading video for the App Video                                                               , Purple Player      , https://i.imgur.com/DIUv5jl.png
15th November 2024 , Fixed issue not saving heading and subtitle                     , Fix~, Fixed an issue which would not save the heading and subtile for FramedView Layout 3                                             , Android Webviews   , https://i.imgur.com/N55kp3Z.png
16th November 2024 , Fixed issue with swapping FramedViews                           , Fix~, Fixed an issue which would not allow swapping FramedViews                                                                       , Android Webviews   , https://i.imgur.com/N55kp3Z.png
20th November 2024 , Fixed an issue which could prevent APIs from working as expected, Fix~, Fixed an issue which could prevent APIs from working as expected                                                                , Cockpit            , https://i.imgur.com/xR0JjJh.png
21st November 2024 , Fixed issue with TheSportsDB League Cards                       , Fix~, Fixed an issue which could prevent TheSportsDB League Cards from working as expected                                            , Android Webviews   , https://i.imgur.com/N55kp3Z.png
23rd November 2024 , Added S9H Store Panel                                           , Add~, Added support for the S9H Store application/mods                                                                                , S9H Store          , https://i.imgur.com/aVueFmt.png
23rd November 2024 , Updated Chatbox in Superadmin                                   , Fix~, Updates from the Telegram group now displayed in the Chatbox in the Superadmin panel                                            , Cockpit            , https://i.imgur.com/xR0JjJh.png
26th November 2024 , FFixed issue with TheSportsDB League Cards                      , Fix~, Fixed an issue which would only show one league and ignored users API Key                                                       , Android Webviews   , https://i.imgur.com/N55kp3Z.png
11th December 2024 , Added support for RTX SmartTube 25.08 mod                       , Add~, Added support for the RTX Mods version of the SmartTube application                                                             , SmartTube          , https://i.imgur.com/dOjhvLv.png
13th December 2024 , Added support for RTX TiviMate 5.1.0-3 mod                      , Add~, Added support for the RTX Mods version of the TiviMate application                                                              , TiviMate           , https://i.imgur.com/uRg0UxZ.png
14th December 2024 , Added Dynamic loading of WebViews to dropdowns                  , Add~, Added support for dynamic loading of WebViews into drop down menus for later use                                                , Cockpit            , https://i.imgur.com/xR0JjJh.png
14th December 2024 , Updated XCIPTV for Dynamic WebView loading                      , Add~, Updated XCIPTV for Dynamic WebView loading                                                                                      , XCIPTV             , https://i.imgur.com/piaorjB.png
14th December 2024 , Updated TiviMate for Dynamic WebView loading                    , Add~, Updated TiviMate for Dynamic WebView loading                                                                                    , TiviMate           , https://i.imgur.com/uRg0UxZ.png
14th December 2024 , Updated Sparkle TV for Dynamic WebView loading                  , Add~, Updated Sparkle TV for Dynamic WebView loading                                                                                  , Sparkle TV         , https://i.imgur.com/qKEbeXG.png
14th December 2024 , Updated Smarters Pro for Dynamic WebView loading                , Add~, Updated Smarters Pro for Dynamic WebView loading                                                                                , Smarters Pro       , https://i.imgur.com/iEb97E1.png
14th December 2024 , Updated Purple Player for Dynamic WebView loading               , Add~, Updated Purple Player for Dynamic WebView loading                                                                               , Purple Player      , https://i.imgur.com/DIUv5jl.png
14th December 2024 , Updated LTQ2 for Dynamic WebView loading                        , Add~, Updated LTQ2 for Dynamic WebView loading                                                                                        , LTQ2               , https://i.imgur.com/5GYEXZD.png
14th December 2024 , Updated IBO Solutions for Dynamic WebView loading               , Add~, Updated IBO Solutions for Dynamic WebView loading                                                                               , IBO Solutions      , https://i.imgur.com/z13H3dJ.png
15th December 2024 , Added support for StreamBox 3.0.0                               , Add~, Added support for StreamBox 3.0.0 with various fixes and improvements                                                           , StreamBox          , https://i.imgur.com/qHBgnHI.png
18th December 2024 , Added extra API for 7.0-1000+                                   , Add~, Added support for extra API parts in XCIPTV 7.0-1000+                                                                           , XCIPTV             , https://i.imgur.com/piaorjB.png
